{
  "schema_version": "substitute_pressure_record_v0",
  "record_count": 1,
  "source_records": [
    {
      "path": "/Users/usbdick/Documents/New project/synrail/fixtures/substitute_kill_test_007/record_checkpoint_restore.json",
      "scenario_id": "SUBSTITUTE_SCENARIO_CHECKPOINT_RESTORE_007",
      "substitute_stack": "manual_verified_restore_checklist_simple",
      "verdict": "SYNRAIL_BETTER"
    }
  ],
  "verdict_counts": {
    "SYNRAIL_BETTER": 1,
    "SUBSTITUTE_GOOD_ENOUGH": 0,
    "UNCLEAR": 0
  },
  "substitute_stack_counts": {
    "manual_verified_restore_checklist_simple": 1
  },
  "reading": {
    "strongest_synrail_edge": "SUBSTITUTE_SCENARIO_CHECKPOINT_RESTORE_007",
    "clearest_substitute_sufficient_path": "",
    "winning_substitute_stacks": [
      "manual_verified_restore_checklist_simple"
    ],
    "non_winning_substitute_stacks": []
  }
}
